{
  "format": 1,
  "limits": {
    "champion_health": 30,
    "max_mana": 10,
    "hand": 10,
    "board": 7,
    "deck_size": 30,
    "copies": 2,
    "copies_by_rarity": {"LEGENDARY": 1},
    "queue_steps": 5000
  },
  "start": {"first_player": "random", "hand": [3, 4], "coin": "GAME_005", "mulligan": true},
  "fatigue": {"enabled": true, "first": 1, "step": 1},
  "timers": {"turn": 75, "fuse": 15, "mulligan": 45, "grace": 5, "away": 30},
  "default_power": "VAN_HERO_08bp",
  "classes": [
    {"id": "DRUID", "champion": "HERO_06"},
    {"id": "HUNTER", "champion": "HERO_05"},
    {"id": "MAGE", "champion": "HERO_08"},
    {"id": "PALADIN", "champion": "HERO_04"},
    {"id": "PRIEST", "champion": "HERO_09"},
    {"id": "ROGUE", "champion": "HERO_03"},
    {"id": "SHAMAN", "champion": "HERO_02"},
    {"id": "WARLOCK", "champion": "HERO_07"},
    {"id": "WARRIOR", "champion": "HERO_01"},
    {"id": "NEUTRAL", "neutral": true},
    {"id": "DREAM", "playable": false},
    {"id": "DEMONHUNTER", "playable": false}
  ],
  "races": ["BEAST", "DEMON", "DRAGON", "MECHANICAL", "MURLOC", "PIRATE", "TOTEM", "UNDEAD"],
  "rarities": [
    {"id": "FREE", "tier": "common"},
    {"id": "COMMON", "tier": "common"},
    {"id": "RARE", "tier": "rare"},
    {"id": "EPIC", "tier": "epic"},
    {"id": "LEGENDARY", "tier": "legendary"}
  ],
  "no_rarity_tier": "common",
  "sets": ["VANILLA", "MISSIONS", "EXPERT1", "LEGACY", "HERO_SKINS", "CORE"],
  "mechanics": {
    "TAUNT": {"engine": "GUARD"},
    "CHARGE": {"engine": "HASTE"},
    "DIVINE_SHIELD": {"engine": "BARRIER"},
    "WINDFURY": {"engine": "DOUBLE_ATTACK"},
    "STEALTH": {"engine": "STEALTH"},
    "ELUSIVE": {"engine": "SPELLPROOF"},
    "CANT_ATTACK": {"engine": "CANT_ATTACK"},
    "IMMUNE": {"engine": "IMMUNE"},
    "SPELLPOWER": {"engine": "SPELL_POWER"},
    "OVERLOAD": {"engine": "MANA_LOCK"},
    "SECRET": {"engine": "TRAP"},
    "FREEZE": {"engine": "FREEZE"},
    "SILENCE": {"engine": "SILENCE"},
    "COUNTER": {"engine": "COUNTER"},
    "BATTLECRY": {"engine": "ON_PLAY"},
    "DEATHRATTLE": {"engine": "ON_DEATH"},
    "COMBO": {"engine": "COMBO"},
    "CHOOSE_ONE": {"engine": "CHOICE"},
    "ENRAGED": {"engine": "WOUNDED"},
    "AURA": {"engine": "AURA"},
    "TRIGGER_VISUAL": {"engine": "TRIGGER"},
    "ADJACENT_BUFF": {"engine": "ADJACENT"},
    "AFFECTED_BY_SPELL_POWER": {"engine": "SPELL_SCALED"},
    "ImmuneToSpellpower": {"engine": "NO_SPELL_POWER"},
    "FROZEN": {"engine": "FROZEN"},
    "FROZEN_THIS_TURN": {"engine": "FROZEN_THIS_TURN"},
    "EXHAUSTED": {"engine": "EXHAUSTED"},
    "ATTACKS": {"engine": "ATTACKS"},
    "ARMOR": {"engine": "ARMOR"},
    "DURABILITY": {"engine": "DURABILITY"},
    "USED": {"engine": "USED"},
    "LOCKED": {"engine": "LOCKED"},
    "GUARDED": {"engine": "GUARDED"},
    "TO_DESTROY": {"engine": "TO_DESTROY"},
    "DIED_POS": {"engine": "DIED_POS"},
    "DOUBLE_HEAL_DAMAGE": {"engine": "POWER_MULTIPLIER"},
    "HEAL_IS_DAMAGE": {"engine": "HEAL_IS_DAMAGE"}
  },
  "modes": {
    "constructed": {
      "sets": ["VANILLA"],
      "class_cards": "own_and_neutral",
      "starter_core": [
        "VAN_EX1_066", "VAN_CS2_172", "VAN_EX1_019", "VAN_CS2_182", "VAN_CS2_147", "VAN_CS2_179",
        "VAN_CS2_200", "VAN_CS2_120", "VAN_EX1_015", "VAN_CS2_189"
      ]
    },
    "arena": {
      "sets": ["VANILLA"],
      "champions_offered": 3,
      "classes": ["DRUID", "HUNTER", "MAGE", "PALADIN", "PRIEST", "ROGUE", "SHAMAN", "WARLOCK", "WARRIOR"],
      "picks": 30,
      "offer": 3,
      "tier_weights": {"common": 765, "rare": 140, "epic": 75, "legendary": 20},
      "special_picks": [1, 10, 20, 30],
      "special_tier_weights": {"rare": 650, "epic": 270, "legendary": 80},
      "class_weight": 3,
      "neutral_weight": 2,
      "copies": 0,
      "wins": 12,
      "losses": 3
    }
  },
  "ranked": {
    "start": {"rank": 25, "stars": 0},
    "ranks": [
      {"rank": 25, "stars": 2, "loses_stars": false, "streak_bonus": true, "emblem": {"card": "VAN_EX1_009"}},
      {"rank": 24, "stars": 2, "loses_stars": false, "streak_bonus": true, "emblem": {"card": "VAN_EX1_029"}},
      {"rank": 23, "stars": 2, "loses_stars": false, "streak_bonus": true, "emblem": {"card": "VAN_EX1_008"}},
      {"rank": 22, "stars": 2, "loses_stars": false, "streak_bonus": true, "emblem": {"card": "VAN_CS2_168"}},
      {"rank": 21, "stars": 2, "loses_stars": false, "streak_bonus": true, "emblem": {"card": "VAN_CS2_146"}},
      {"rank": 20, "stars": 3, "floor": true, "streak_bonus": true, "emblem": {"card": "VAN_EX1_405"}},
      {"rank": 19, "stars": 3, "streak_bonus": true, "emblem": {"card": "VAN_EX1_015"}},
      {"rank": 18, "stars": 3, "streak_bonus": true, "emblem": {"card": "VAN_EX1_608"}},
      {"rank": 17, "stars": 3, "streak_bonus": true, "emblem": {"card": "VAN_EX1_390"}},
      {"rank": 16, "stars": 3, "streak_bonus": true, "emblem": {"card": "VAN_EX1_044"}},
      {"rank": 15, "stars": 4, "streak_bonus": true, "emblem": {"card": "VAN_EX1_023"}},
      {"rank": 14, "stars": 4, "streak_bonus": true, "emblem": {"card": "VAN_CS2_122"}},
      {"rank": 13, "stars": 4, "streak_bonus": true, "emblem": {"card": "VAN_NEW1_022"}},
      {"rank": 12, "stars": 4, "streak_bonus": true, "emblem": {"card": "VAN_EX1_084"}},
      {"rank": 11, "stars": 4, "streak_bonus": true, "emblem": {"card": "VAN_EX1_005"}},
      {"rank": 10, "stars": 5, "streak_bonus": true, "emblem": {"card": "VAN_CS2_197"}},
      {"rank": 9, "stars": 5, "streak_bonus": true, "emblem": {"card": "VAN_CS2_151"}},
      {"rank": 8, "stars": 5, "streak_bonus": true, "emblem": {"card": "VAN_CS2_226"}},
      {"rank": 7, "stars": 5, "streak_bonus": true, "emblem": {"card": "VAN_EX1_032"}},
      {"rank": 6, "stars": 5, "streak_bonus": true, "emblem": {"card": "VAN_EX1_178"}},
      {"rank": 5, "stars": 5, "emblem": {"card": "VAN_EX1_586"}},
      {"rank": 4, "stars": 5, "emblem": {"card": "VAN_EX1_105"}},
      {"rank": 3, "stars": 5, "emblem": {"card": "VAN_EX1_620"}},
      {"rank": 2, "stars": 5, "emblem": {"card": "VAN_EX1_002"}},
      {"rank": 1, "stars": 5, "emblem": null}
    ],
    "streak": {"wins": 3, "bonus_stars": 1},
    "legend": {"after_rank": 1, "keep_for_season": true, "numbered_top": 10000, "emblem": null},
    "season": {"length": "month", "reset": {"to_rank": 25, "stars_per_rank_above": 1, "legend_counts_as": 0}}
  }
}
